{
  "ecosystem_id": "ecosystem-001",
  "installation_id": "installation-001",
  "runtime_instance_id": "embedded-runtime",
  "host_kind": "companion-app",
  "bot_id": "bot-main",
  "platform": null,
  "account_id": null,
  "conversation_ref": "conversation-001",
  "platform_conversation_id": null,
  "session_id": null,
  "user_id": null,
  "group_id": null,
  "persona_id": "persona-main",
  "persona_binding_revision": 12
}
