{
  "ecosystem_id": "ecosystem-001",
  "installation_id": "installation-001",
  "runtime_instance_id": "runtime-001",
  "host_kind": "astrbot",
  "bot_id": "bot-main",
  "platform": "aiocqhttp",
  "account_id": "qq-bot-001",
  "conversation_ref": "conversation-001",
  "platform_conversation_id": "private-user-123",
  "session_id": "reading-session-001",
  "user_id": "user-123",
  "group_id": null,
  "persona_id": "persona-main",
  "persona_binding_revision": 12
}
